{
  "$schema":"https://json-schema.org/draft/2020-12/schema","$id":"proof-obligation-registry.schema.json","title":"Proof obligation registry","type":"object","additionalProperties":false,
  "required":["contractVersion","profileId","profileVersion","artifactSha256","profileCoverageRequired","semanticDetailsRequired","applicableModules","obligations","hypotheses","useSites","boundaries","randomDistributions","convergenceChecks","exactArithmetic","theoremReferences"],
  "properties":{
    "contractVersion":{"type":"string","minLength":1},"profileId":{"type":"string","minLength":1},"profileVersion":{"type":"string","minLength":1},"artifactSha256":{"type":"string","pattern":"^[0-9a-f]{64}$"},
    "profileCoverageRequired":{"type":"boolean"},"semanticDetailsRequired":{"type":"boolean"},
    "applicableModules":{"type":"array","minItems":1,"items":{"type":"object","additionalProperties":false,"required":["id","applicable","rationale"],"properties":{"id":{"type":"string","minLength":1},"applicable":{"type":"boolean"},"rationale":{"type":"string","minLength":1}}}},
    "obligations":{"type":"array","items":{"$ref":"#/$defs/obligation"}},"hypotheses":{"type":"array","items":{"$ref":"#/$defs/ledger"}},
    "useSites":{"type":"array","items":{"$ref":"#/$defs/useSite"}},"boundaries":{"type":"array","items":{"$ref":"#/$defs/ledger"}},
    "randomDistributions":{"type":"array","items":{"$ref":"#/$defs/distribution"}},"convergenceChecks":{"type":"array","items":{"$ref":"#/$defs/convergence"}},
    "exactArithmetic":{"type":"array","items":{"$ref":"#/$defs/arithmetic"}},"theoremReferences":{"type":"array","items":{"$ref":"#/$defs/theoremReference"}},
    "waivers":{"type":"array","items":{"type":"object","additionalProperties":false,"required":["id","owner","reason","scope","expires"],"properties":{"id":{"type":"string"},"owner":{"type":"string"},"reason":{"type":"string"},"scope":{"type":"string"},"expires":{"type":"string"}}}}
  },
  "$defs":{
    "id":{"type":"string","pattern":"^[A-Z][A-Z0-9_-]+$"},"stringArray":{"type":"array","items":{"type":"string","minLength":1}},
    "historyEvent":{"type":"object","additionalProperties":false,"required":["event"],"properties":{"event":{"type":"string","minLength":1},"at":{"type":"string","minLength":1},"actor":{"type":"string","minLength":1},"reason":{"type":"string","minLength":1}}},
    "evidence":{"type":"object","additionalProperties":false,"required":["type","path"],"properties":{"type":{"type":"string","minLength":1},"path":{"type":"string","minLength":1},"locator":{"type":"string"},"sha256":{"type":"string","pattern":"^[0-9a-f]{64}$"}}},
    "pathTuple":{"type":"object","additionalProperties":false,"required":["parameterDomain","formula","startEndpoint","endEndpoint","ambientMembership","derivative","ftcBounds"],"properties":{"parameterDomain":{"type":"string","minLength":1},"formula":{"type":"string","minLength":1},"startEndpoint":{"type":"string","minLength":1},"endEndpoint":{"type":"string","minLength":1},"ambientMembership":{"type":"string","minLength":1},"derivative":{"type":"string","minLength":1},"ftcBounds":{"type":"string","minLength":1}}},
    "obligation":{"type":"object","additionalProperties":false,"required":["id","templateId","kind","required","statement","status","evidence","verificationMethod","history"],"properties":{"id":{"$ref":"#/$defs/id"},"templateId":{"$ref":"#/$defs/id"},"kind":{"enum":["definition","lemma","use-site","boundary","complexity","document"]},"required":{"type":"boolean"},"statement":{"type":"string","minLength":1},"hypothesisIds":{"$ref":"#/$defs/stringArray"},"dependencyIds":{"$ref":"#/$defs/stringArray"},"useSiteIds":{"$ref":"#/$defs/stringArray"},"boundaryIds":{"$ref":"#/$defs/stringArray"},"status":{"enum":["open","supported","verified","failed","stale","waived"]},"evidence":{"type":"array","items":{"$ref":"#/$defs/evidence"}},"verificationMethod":{"type":"string"},"history":{"type":"array","items":{"$ref":"#/$defs/historyEvent"}},"pathTuple":{"$ref":"#/$defs/pathTuple"},"displayedEndpoint":{"type":"string"}},"allOf":[{"if":{"properties":{"kind":{"const":"use-site"}}},"then":{"required":["pathTuple"]}}]},
    "ledger":{"type":"object","additionalProperties":false,"required":["id","required","status","evidence","history"],"properties":{"id":{"$ref":"#/$defs/id"},"required":{"type":"boolean"},"status":{"enum":["open","supported","verified","covered","failed","stale","waived","not-applicable"]},"reason":{"type":"string"},"obligationIds":{"$ref":"#/$defs/stringArray"},"evidence":{"type":"array","items":{"$ref":"#/$defs/evidence"}},"history":{"type":"array","items":{"$ref":"#/$defs/historyEvent"}}}},
    "useSite":{"type":"object","additionalProperties":false,"required":["id","required","status","evidence","history","lowerObject","upperObject","sideConditions","substitution"],"properties":{"id":{"$ref":"#/$defs/id"},"required":{"type":"boolean"},"status":{"enum":["open","supported","verified","covered","failed","stale","waived","not-applicable"]},"reason":{"type":"string"},"obligationIds":{"$ref":"#/$defs/stringArray"},"evidence":{"type":"array","items":{"$ref":"#/$defs/evidence"}},"history":{"type":"array","items":{"$ref":"#/$defs/historyEvent"}},"lowerObject":{"type":"string","minLength":1},"upperObject":{"type":"string","minLength":1},"sideConditions":{"type":"string","minLength":1},"substitution":{"type":"string","minLength":1}}},
    "distribution":{"type":"object","additionalProperties":false,"required":["id","required","status","evidence","history","support","coordinateProbabilities","exclusions","couplingOrConditioning","interchangeJustification"],"properties":{"id":{"$ref":"#/$defs/id"},"required":{"type":"boolean"},"status":{"enum":["open","supported","verified","covered","failed","stale","waived","not-applicable"]},"reason":{"type":"string"},"obligationIds":{"$ref":"#/$defs/stringArray"},"evidence":{"type":"array","items":{"$ref":"#/$defs/evidence"}},"history":{"type":"array","items":{"$ref":"#/$defs/historyEvent"}},"support":{"type":"string","minLength":1},"coordinateProbabilities":{"type":"string","minLength":1},"exclusions":{"type":"string","minLength":1},"couplingOrConditioning":{"type":"string","minLength":1},"interchangeJustification":{"type":"string","minLength":1}}},
    "convergence":{"type":"object","additionalProperties":false,"required":["id","required","status","evidence","history","truncation","uniformBound","limitingTheorem","hypotheses"],"properties":{"id":{"$ref":"#/$defs/id"},"required":{"type":"boolean"},"status":{"enum":["open","supported","verified","covered","failed","stale","waived","not-applicable"]},"reason":{"type":"string"},"obligationIds":{"$ref":"#/$defs/stringArray"},"evidence":{"type":"array","items":{"$ref":"#/$defs/evidence"}},"history":{"type":"array","items":{"$ref":"#/$defs/historyEvent"}},"truncation":{"type":"string","minLength":1},"uniformBound":{"type":"string","minLength":1},"limitingTheorem":{"type":"string","minLength":1},"hypotheses":{"type":"string","minLength":1}}},
    "arithmetic":{"type":"object","additionalProperties":false,"required":["id","required","status","evidence","history","inputEncoding","integerScaling","oracleCalls","maximumMagnitude","signedBitLength","exactComparisons","soundness","completeness","candidateCompleteness"],"properties":{"id":{"$ref":"#/$defs/id"},"required":{"type":"boolean"},"status":{"enum":["open","supported","verified","covered","failed","stale","waived","not-applicable"]},"reason":{"type":"string"},"obligationIds":{"$ref":"#/$defs/stringArray"},"evidence":{"type":"array","items":{"$ref":"#/$defs/evidence"}},"history":{"type":"array","items":{"$ref":"#/$defs/historyEvent"}},"inputEncoding":{"type":"string","minLength":1},"integerScaling":{"type":"string","minLength":1},"oracleCalls":{"type":"string","minLength":1},"maximumMagnitude":{"type":"string","minLength":1},"signedBitLength":{"type":"string","minLength":1},"exactComparisons":{"type":"string","minLength":1},"soundness":{"type":"string","minLength":1},"completeness":{"type":"string","minLength":1},"candidateCompleteness":{"type":"string","minLength":1}}},
    "theoremReference":{"type":"object","additionalProperties":false,"required":["id","required","status","evidence","history","sourceLabel","referenceCommand","targetEnvironment","numbered","compatibleKind"],"properties":{"id":{"$ref":"#/$defs/id"},"required":{"type":"boolean"},"status":{"enum":["open","supported","verified","covered","failed","stale","waived","not-applicable"]},"reason":{"type":"string"},"obligationIds":{"$ref":"#/$defs/stringArray"},"evidence":{"type":"array","items":{"$ref":"#/$defs/evidence"}},"history":{"type":"array","items":{"$ref":"#/$defs/historyEvent"}},"sourceLabel":{"type":"string","minLength":1},"referenceCommand":{"enum":["ref","eqref","autoref"]},"targetEnvironment":{"type":"string","minLength":1},"numbered":{"type":"boolean"},"compatibleKind":{"type":"boolean"}}}
  }
}
