{
    "contractVersion":  "1.0.0",
    "profileId":  "submodular-optimization",
    "profileVersion":  "1.0.0",
    "artifactSha256":  "aaaaaaaaaaaaaaaaaaaaaaaaaaaaaaaaaaaaaaaaaaaaaaaaaaaaaaaaaaaaaaaa",
    "profileCoverageRequired":  true,
    "semanticDetailsRequired":  true,
    "obligations":  [
                        {
                            "id":  "OB-PRODUCT-DISTRIBUTION",
                            "templateId":  "OB-PRODUCT-DISTRIBUTION",
                            "kind":  "definition",
                            "required":  true,
                            "statement":  "Define product random sets, exclusions, and marginals.",
                            "status":  "verified",
                            "evidence":  [
                                             {
                                                 "type":  "artifact-location",
                                                 "path":  "proof.tex"
                                             }
                                         ],
                            "verificationMethod":  "fixture-review",
                            "history":  [
                                            {
                                                "event":  "created"
                                            }
                                        ]
                        },
                        {
                            "id":  "OB-FIRST-PARTIAL",
                            "templateId":  "OB-FIRST-PARTIAL",
                            "kind":  "lemma",
                            "required":  true,
                            "statement":  "Derive first derivative by conditioning.",
                            "status":  "verified",
                            "evidence":  [
                                             {
                                                 "type":  "artifact-location",
                                                 "path":  "proof.tex"
                                             }
                                         ],
                            "verificationMethod":  "fixture-review",
                            "history":  [
                                            {
                                                "event":  "created"
                                            }
                                        ]
                        },
                        {
                            "id":  "OB-MIXED-PARTIAL",
                            "templateId":  "OB-MIXED-PARTIAL",
                            "kind":  "lemma",
                            "required":  true,
                            "statement":  "Express mixed derivative as expected second difference and prove sign.",
                            "status":  "verified",
                            "evidence":  [
                                             {
                                                 "type":  "artifact-location",
                                                 "path":  "proof.tex"
                                             }
                                         ],
                            "verificationMethod":  "fixture-review",
                            "history":  [
                                            {
                                                "event":  "created"
                                            }
                                        ]
                        },
                        {
                            "id":  "OB-DR-ANTITONE",
                            "templateId":  "OB-DR-ANTITONE",
                            "kind":  "lemma",
                            "required":  true,
                            "statement":  "Prove coordinate derivative antitonicity on the cube.",
                            "status":  "verified",
                            "evidence":  [
                                             {
                                                 "type":  "artifact-location",
                                                 "path":  "proof.tex"
                                             }
                                         ],
                            "verificationMethod":  "fixture-review",
                            "history":  [
                                            {
                                                "event":  "created"
                                            }
                                        ]
                        },
                        {
                            "id":  "OB-PATH-TUPLE",
                            "templateId":  "OB-PATH-TUPLE",
                            "kind":  "use-site",
                            "required":  true,
                            "statement":  "Record domain, formula, endpoints, membership, derivative, and FTC bounds.",
                            "status":  "verified",
                            "evidence":  [
                                             {
                                                 "type":  "artifact-location",
                                                 "path":  "proof.tex"
                                             }
                                         ],
                            "verificationMethod":  "fixture-review",
                            "history":  [
                                            {
                                                "event":  "created"
                                            }
                                        ],
                            "pathTuple":  {
                                              "parameterDomain":  "t in [0,1]",
                                              "formula":  "x(t)",
                                              "startEndpoint":  "x(0)",
                                              "endEndpoint":  "x(1)",
                                              "ambientMembership":  "x(t) in cube",
                                              "derivative":  "dx/dt",
                                              "ftcBounds":  "0 to 1"
                                          },
                            "displayedEndpoint":  "x(1)"
                        },
                        {
                            "id":  "OB-POSITIVE-PART",
                            "templateId":  "OB-POSITIVE-PART",
                            "kind":  "lemma",
                            "required":  true,
                            "statement":  "Prove the positive-part inequality with sign checks.",
                            "status":  "verified",
                            "evidence":  [
                                             {
                                                 "type":  "artifact-location",
                                                 "path":  "proof.tex"
                                             }
                                         ],
                            "verificationMethod":  "fixture-review",
                            "history":  [
                                            {
                                                "event":  "created"
                                            }
                                        ]
                        },
                        {
                            "id":  "OB-RADIAL",
                            "templateId":  "OB-RADIAL",
                            "kind":  "lemma",
                            "required":  true,
                            "statement":  "Prove the radial gradient inequality with endpoint checks.",
                            "status":  "verified",
                            "evidence":  [
                                             {
                                                 "type":  "artifact-location",
                                                 "path":  "proof.tex"
                                             }
                                         ],
                            "verificationMethod":  "fixture-review",
                            "history":  [
                                            {
                                                "event":  "created"
                                            }
                                        ]
                        },
                        {
                            "id":  "OB-NORMALIZATION",
                            "templateId":  "OB-NORMALIZATION",
                            "kind":  "lemma",
                            "required":  true,
                            "statement":  "Source or derive normalization at the origin.",
                            "status":  "verified",
                            "evidence":  [
                                             {
                                                 "type":  "artifact-location",
                                                 "path":  "proof.tex"
                                             }
                                         ],
                            "verificationMethod":  "fixture-review",
                            "history":  [
                                            {
                                                "event":  "created"
                                            }
                                        ]
                        },
                        {
                            "id":  "OB-IMPROPER-CONVERGENCE",
                            "templateId":  "OB-IMPROPER-CONVERGENCE",
                            "kind":  "lemma",
                            "required":  true,
                            "statement":  "Prove truncated integral convergence and interchange hypotheses.",
                            "status":  "verified",
                            "evidence":  [
                                             {